profile_id_dummy,education_institute,degree_name,start_year_degree,end_year_degree
111,"Indian Institute of Technology, Kharagpur","Bachelor of Technology (BTech), Computer Science",1900,1900
112,Bengal College of Engineering and Technology,"Bachelor of Technology (B.Tech.), Electronics and Commu",2008,2012
112,University of Southern California,"Master of Science (MS), Computer Science",2014,2015
113,West Virginia University,"Doctor of Philosophy (Ph.D.), Engineering",2010,2014
113,West Virginia University,"Master of Science (MSc), Petroleum and Natural Gas Engineering",2010,2012
113,Sharif University of Technology,"Bachelor of Science (BSc), Petroleum Engineering",2005,2010
114,University at Buffalo,"Master's degree, Geography",2000,2000
114,Clark University,"Bachelor's degree, Geography",1992,1996
115,The Ohio State University,"Doctor of Philosophy (Ph.D.), Statistics",2012,2017
115,Fudan University,"B.S., Mathematics",2012,2012
116,University of Delaware,"Doctor of Philosophy (Ph.D.), Bioinformatics and Systems Biology",1900,1900
116,Louisiana State University,Masters,1900,1900
117,New York University,"Master's degree, Computer Engineering",2019,2020
117,Delhi College of Engineering,"Bachelor of Technology, Electronics and Communication with specialization in Applied Physics",2015,2019
117,"Frank Anthony Public School,New Delhi",,2001,2015
118,Penn State University,"Ph.D., Computer Engineering",2014,2014
118,Dalhousie University,"BE, Electrical Engineering",2004,2004
119,Dhirubhai Ambani Institute of Information and Communication Technology,"Bachelor of Technology (B.Tech.), ICT (Information And Communication Technology)",2006,2010
