profile_id_dummy,education_institute,degree_name,start_year_degree,end_year_degree
0,Faculty of Management Studies - University of Delhi,Master of Business Administration (MBA),2016,2018
0,Narayana Junior College - India,Mathematics Physics Chemistry,2010,2012
0,National Institute of Technology Karnataka,"Bachelor of Technology - BTech, Computer Science Engineering",2012,2016
1,University of Illinois Urbana-Champaign,"Master of Business Administration - MBA, Entrepreneurship/Entrepreneurial Studies",2019,2021
1,Rice University,"Bachelor’s Degree, Chemical and Biomolecular Engineering, Economics",2009,2013
2,Walsh College,"Master of Business Administration - MBA, Technology and Data Science",2021,2022
2,Liverpool John Moores University,"Online Master's degree, Machine Learning and Artificial Intelligence",2020,2022
2,BMS Institute of Technology and Management,"Bachelor of Technology (B.Tech.), Computer Science",2012,2016
6,Vellore Institute of Technology,"Bachelor's degree, Electronics and Communication Engineering",2013,2017
6,Jamnalal Bajaj Institute of Management Studies (JBIMS),"Masters in Management Studies, Business Administration and Management, General",2021,2022
7,Emory University - Goizueta Business School,"Master of Business Administration - MBA, Strategy, Business Analysis (STEM)",2020,2022
7,Savitribai Phule Pune University,"Bachelor of Engineering (B.E.), Mechanical",2008,2012
8,Symbiosis Centre for Management Studies- Pune,"Bachelor’s Degree, BBA in Finance and Accounts",2012,2015
8,National University of Singapore,"Master of Business Administration - MBA, Strategy and Organization & Consulting",2020,2022
8,Lourdes Convent High School,"Business/Commerce, General",2001,2012
9,"Birla Institute of Technology and Science, Pilani","B.E.(Hons.) Electrical and Electronics Engineering, M.Sc.(Hons.) Chemistry",2009,2014
9,EDHEC Business School,"International Exchange Participant, Strategy Consulting and Digital Transformation",2018,2018
9,"Indian Institute of Management, Indore",Master of Business Administration (MBA),2016,2018
10,Rajiv Gandhi Prodyogiki Vishwavidyalaya,"Bachelor's degree, Computer Software Engineering",2008,2012
10,Indian Institute of Management Ahmedabad,Post Graduate Programme,2013,2015
11,DIT UNIVERSITY,"Bachelor of Technology (B.Tech.), Mechanical Engineering",2011,2015
11,"DAV Public School, Amritsar",,1996,2011
12,Delhi Public School  Mathura Road,"High School, Science",2002,2013
12,Netaji Subhas Institute of Technology,"Bachelor’s Degree, Electronics and Communications Engineering",2013,2017
12,University of Minnesota - Carlson School of Management,"Master of Science - MS, Business Analytics",2022,2022
13,Carnegie Mellon University - Heinz College of Information Systems and Public Policy,"Master of Science - MS, Management, Data Analytics and Information Technology",2021,2023
13,"Daulat Ram College, Delhi University","Bachelor of Arts (B.A.) Hons., Economics",2012,2015
13,Harris School of Public Policy at the University of Chicago,Anubhav lecture Series,2018,2018
14,Jaypee University of Information Technology,"Bachelor's degree, Biotechnology",2014,2018
14,Laureate Public School,"CBSE 12, Biological and Biomedical Sciences",2013,2014
14,Yeshiva University,"Master of Science - MS, Biotechnology Management & Entrepreneurship",2021,2022
15,Purdue University Krannert School of Management,"Master of Science - MS, Business Analytics and Information Management",2022,2023
15,Fr. Conceicao Rodrigues Institute of Technology,"Bachelor of Engineering - BE, Electronics and Communications Engineering",2013,2017
15,Indian Institute of Foreign Trade,"Master of Business Administration - MBA, International Business",2019,2021
16,Shri Ram College of Commerce,"Bachelor of Commerce with Honours (B.Com Hons), Business/Commerce, General",2015,2018
16,The London School of Economics and Political Science (LSE),"Summer School, Asset Markets and Corporate Finance",2016,2016
16,Delhi Public School - R. K. Puram,"Business/Commerce, General",2003,2015
17,Indian School of Business,Master of Business Administration (MBA),2017,2018
17,Maharaja Agrasen Institute Of Technology,"Bachelor of Technology (B.Tech.), Computer Science",2008,2012
17,Indian Military Academy,"Post graduate Diploma, Military and Strategic Leadership",2013,2014
18,Patna Science College,,1900,1900
18,"Questrom School of Business, Boston University",MBA & MS-Digital Technology,2020,2022
18,"Indian Institute of Technology, Kanpur","Integrated MS, Mathematics and Scientific Computing",2005,2010
19,Acharya Nagarjuna University,"Bachelor's degree, Electrical and Electronics Engineering",2009,2013
19,Wright State University,"Master's degree, Electrical and Electronics Engineering",2013,2015
19,"University of California, Davis - Graduate School of Management",Master of Business Administration - MBA,2021,2023
20,Indian School of Business,Master of Business Administration - MBA,2020,2021
20,"South Asian university, New Delhi",Master in Economics,2013,2015
20,"SGTB Khalsa College, Delhi University",B.A. (HONS.) Economics,2010,2013
21,University of Pennsylvania,"Master of Liberal Arts, Organizational Behavior Studies",2018,2020
21,American University,"Bachelor of Arts (B.A.), Psychology",2017,2017
22,Vellore Institute of Technology,"Bachelor of Technology, Electronics and Communication Engineering",2015,2019
22,Duke University - The Fuqua School of Business,Masters in Management Studies,2022,2022
22,Narsee Monjee Educational Trust's - Jamnabai Narsee School,"ISC, Science",1900,1900
23,The Institute of Chartered Accountants of India,"Chartered Accountant, Accounting and Finance",2013,2017
23,R A Podar College of Commerce & Economics Matunga Mumbai 400 019,"Bachelor of Commerce - BCom, Accounting and Finance",2011,2016
23,University of Mumbai,"Master's degree, Business/Commerce, General",2017,2018
24,Northwestern University - Kellogg School of Management,Master of Business Administration - MBA,2022,2023
24,"National Institute of Technology Karnataka,Surathkal","Bachelor of Technology (BTech), Chemical Engineering",2012,2016
24,Kalka Public School (Fiitjee Pinnacle),"High School, Science",2010,2012
25,Lycée Masséna,"Preparatory class to the Grandes Écoles (CPGE), MPSI-MP",2017,2019
25,Ecole Centrale de Marseille,"Master of Engineering - MEng, General Engineering",2019,2021
25,University of Rochester,"Master of Science - MS, Technical Entrepreneurship And Management",2021,2022
26,Central Board of Secondary Education,"High School (Tenth Grade board examination) , General",1900,1900
26,UNC Kenan-Flagler Business School,Master of Business Administration - MBA,2019,2021
26,Jaypee Institute Of Information Technology,"Bachelor's degree, Computer Science and Engineering",2011,2015
27,L.M. College Of Pharmacy,"Bachelor’s Degree, Pharmacy",2008,2012
27,National Institute of Pharmaceutical Education and Research,"Master’s Degree, Pharmaceutical Technology",2012,2014
27,UNC Kenan-Flagler Business School,"Master of Business Administration - MBA, Marketing",2019,2021
28,Massachusetts Institute of Technology,"Executive Program, Digital Marketing Analytics",2020,2020
28,Indian Institute of Management Bangalore,"Post Graduate Diploma in Management (equivalent to MBA), Strategy and marketing",2008,2010
28,HEC Paris,"Exchange term, Strategy",2009,2009
29,"Indian Institute of Technology, Delhi","Bachelor of Technology - BTech, Biochemical Engineering and Biotechnology",2015,2019
29,"Delhi Public School, Faridabad",,2000,2015
30,"KJ Somaiya College of Engineering, Vidyavihar","Bachelor of Engineering, Electronics and Communications Engineering",2013,2017
30,Purdue University,"Master's degree, Engineering Management",2021,2022
31,Maharashtra Institute of Technology,"Bachelor of Engineering - BE, Mechanical Engineering",2017,2017
31,University of Connecticut School of Business,"Master of Science - MS, Business Analytics and Project Management",2021,2022
32,Stanford University,"M.A., Linguistics",1978,1980
32,Stanford University,"Ph.D., Linguistics, minor in Japanese",1980,1985
32,San Francisco Conservatory of Music,"BMus, Orchestra conducting, clarinet performance",1975,1977
33,National Institute of Technology Kurukshetra,"Bachelor of Technology (B.Tech.), Electronics and Communications Engineering",2006,2010
33,Narayana Junior College,,2005,2006
33,Indian School of Business,"Master of Business Administration (MBA), Marketing and Operations",2014,2015
34,Faculty of Management Studies - University of Delhi,"Master of Business Administration (M.B.A.), Marketing and Finance",2012,2014
34,Netaji Subhas Institute of Technology,"Bachelor's Degree, Electronics and Communications Engineering",2008,2012
35,Little Flower School,"Matriculation, History, Civics, Math, Geography, Basic Sciences, Computer Applications, Hindi, English",2002,2014
35,"Indian Institute of Technology, Bombay","Bachelor of Technology (B.Tech.), Chemical Engineering",2016,2020
35,Vidya Bharati Chinmaya Vidyalaya,"Intermediate, English, Computer Science, Science, Math",2014,2016
36,Emory University - Goizueta Business School,"Executive Education, Business",2011,2011
36,Massachusetts Institute of Technology,Data Science and Big Data Analytics,2018,2018
36,The Johns Hopkins University,"Executive, Executive Data Science & Data Science Specialization",2016,2017
37,Vellore Institute of Technology,"Bachelor of Technology - BTech, Mechanical Engineering",2009,2013
37,Massachusetts Institute of Technology,"Master of Science - MS, Supply Chain Management",2021,2022
37,Faculty of Management Studies - University of Delhi,"Master of Business Administration - MBA, Operations and Marketing",2015,2017
38,Indian Institute of Management Udaipur,"Master of Business Administration - MBA, Business Administration and Management, General",2019,2021
38,National Institute of Technology Warangal,"Engineer’s Degree, Civil Engineering",2012,2016
38,Berlin British School,High School,2008,2012
39,"Indian Institute of Management, Lucknow",Master of Business Administration - MBA,2017,2019
39,Delhi Technological University (Formerly DCE),"Bachelor of Technology (B.Tech.), Electrical and Electronics Engineering",2012,2016
40,Carnegie Mellon University - Tepper School of Business,Master of Business Administration - MBA,2022,2024
40,Jawaharlal Nehru Technological University,"Bachelor of Technology - BTech, Electronics and Communications Engineering",2007,2011
41,SVKM's Narsee Monjee Institute of Management Studies (NMIMS),Master of Business Administration - MBA,2019,2021
41,B. M. S. College of Engineering,"Bachelor of Technology - BTech, Mechanical Engineering",2010,2014
41,Sommerville Scool Noida,,1996,2010
42,HEC Paris,Master of Business Administration - MBA,2021,2021
42,Northwestern University - Kellogg School of Management,Master of Business Administration - MBA,2019,2021
42,"Indian Institute of Technology, Bombay","Master of Technology (M.Tech.), Nanotechnology",2010,2015
43,Columbia Engineering,"M.S., Business Analytics with Concentration in Fintech",1900,1900
43,Columbia Business School,"M.S., Business Analytics",2018,2020
43,The Wharton School,"Undergraduate Exchange Student, Statistics and Economics",1900,1900
44,"Birla Institute of Technology and Science, Pilani","Bachelor of Engineering (B.E.), Electrical and Electronics Engineering",2011,2016
44,"Birla Institute of Technology and Science, Pilani","Master's degree, Economics",2011,2016
45,"Birla Institute of Technology and Science, Pilani",Chemical Engineering,2010,2014
45,Kendriya Vidyalaya,"Intermediate, Science",2008,2010
45,National Institute of Industrial Engineering,"Master of Business Administration - MBA, Operations & Strategy",2017,2019
46,INSEAD,Master of Business Administration - MBA,2010,2011
46,"Indian Institute of Technology, Bombay",Bachelor of Technology - BTech,2000,2004
47,SVKM's Narsee Monjee Institute of Management Studies (NMIMS),"Bachelor of Technology (B.Tech.), Computers",1900,1900
47,SVKM's Narsee Monjee Institute of Management Studies (NMIMS),"Master of Business Administration (MBA), Finance",1900,1900
47,Harvard University,"HPAIR Fellow - Entrepreneurship, Entrepreneurship/Entrepreneurial Studies",2013,2013
48,Northwestern University - Kellogg School of Management,Master of Business Administration (MBA),2013,2015
48,"Indian Institute of Technology, Kanpur","BTech, Mechanical Engineering",2003,2007
48,Bansals,,1900,1900
49,Maharani Gayatri Devi Girls School,,1994,2006
49,SVKM's Narsee Monjee Institute of Management Studies (NMIMS),"MBA-tech, Finance/Marketing",2006,2011
49,Northwestern University - Kellogg School of Management,Master of Business Administration (MBA),2015,2017
50,Shaheed Sukhdev College Of Business Studies,"Bachelor of Business Studies, Finance, General",2009,2012
50,G.D.Goenka Public School,Finance,2001,2009
51,Indian Institute of Management Bangalore,"Post Graduate Diploma in Management, Marketing, Strategy and Finance",2008,2010
51,Northwestern University - Kellogg School of Management,"Master of Business Administration (MBA), Management & Strategy, Finance and Marketing",2014,2015
51,"Indian Institute of Technology (Banaras Hindu University), Varanasi","Bachelor of Technology, Metallurgical Engineering",2004,2008
52,Cornell University,"Doctor of Philosophy (PhD), Mechanical Engineering",1900,1900
52,"Indian Institute of Technology, Delhi","Bachelor of Technology (B.Tech.), Mechanical Engineering",1900,1900
52,Cornell University,"Master of Science (M.S.), Mechanical Engineering",1900,1900
53,The University of Texas at Austin,"Bachelor of Science (BS), Chemical Engineering",2012,2016
53,Anderson High School,,2008,2012
54,University of Cincinnati,"MS, Mechanical Engineering",2003,2005
54,Harvard Business School,"Executive Program, Driving Corporate Performance",2010,2010
54,Northwestern University - Kellogg School of Management,"MBA, Finance & Analytical Consulting",2011,2013
55,MIT Sloan School of Management,"MBA, Strategy and Finance",2007,2009
55,"Indian Institute of Technology, Kharagpur","B-Tech, Electrical Engineering",1900,1900
56,Indian Institute of Management Ahmedabad,"PGP, General Management",2011,2013
56,"SSN College of Engineering, Anna University","B.E., Electronics & Communications",2005,2009
57,Indian School of Business,"Master of Business Administration (MBA), Strategy and Marketing",2015,2016
57,Indian Institute of Technology Jodhpur,"Bachelor of Technology (B.Tech.), Electrical and Electronics Engineering",2009,2013
57,"Sir Parashurambhau College, Pune","Higher Secondary School Certificate, Science",2007,2009
59,Indian Institute of Management Ahmedabad,"PGPX (One-year MBA), Management",2006,2007
59,New Jersey Institute of Technology,"M.S., Mechanical Engineering",1995,1996
59,"Indian Institute of Technology, Bombay","B.Tech, Mechanical Engineering",1991,1995
60,Vanderbilt University,"BS, Economics, Computer Science",1900,1900
60,Southern Methodist University,"MS, Systems Engineering",1900,1900
61,Yale University,"PhD Program, Classics, Comparative Literature",1992,2000
61,Princeton University,"1992, Comparative Literature",1988,1992
62,Purdue University,"Master’s Degree, Industrial Engineering",2013,2015
62,"University of California, Berkeley","Bachelor of Science (BS), Nuclear Engineering, Mechanical Engineering",2004,2007
62,Indiana University - Kelley School of Business,"Master of Business Administration (M.B.A.), Business Administration and Management, General",2014,2017
63,Bangalore University,"BE, Computer Science",1900,1900
63,Stevens Institute of Technology,"MBA, Technology Management",1900,1900
63,"Birla Institute of Technology and Science, Pilani","MS, Software systems",1900,1900
64,The University of Chicago Booth School of Business,"MBA (with Honors), Finance, Strategy, Operations, Entrepreneurship",1900,1900
64,"Institute of Management Technology, Ghaziabad","Postgraduate Diploma in Business Management, Marketing,",1900,1900
64,Osmania University,"Bachelor of Computer Applications, Computer Science",1900,1900
65,Faculty of Management Studies - University of Delhi,"MBA, Strategy, Marketing and Finance",2002,2004
65,Osmania University,"BE, Mechanical Engineering",1998,2002
66,University of Cambridge,"Master of Philosophy (M.Phil.), Technology Policy",1900,1900
66,Massachusetts Institute of Technology,"Master of Engineering (M.Eng.), Electrical Engineering and Computer Science",1900,1900
66,Massachusetts Institute of Technology,"Bachelor of Science (B.S.), Electrical Engineering and Computer Science",1900,1900
67,Weatherhead School of Management at Case Western Reserve University,MEM,2004,2005
67,Case Western Reserve University,Bachelors of Systems and Control Engineering,2005,2005
67,McKinsey & Company,Mini MBA,2007,2007
68,Westwood High School,International Baccalaureate Diploma,2003,2007
68,The University of Texas at Austin,"BBA, Supply Chain Management",2007,2010
68,Harvard Business School,Master of Business Administration (MBA),2013,2015
69,Columbia Business School,Certificate in ESG Investing,2022,2022
69,University of Cambridge,Master of Business Administration (MBA),1900,1900
69,Carnegie Mellon University,"M.S. Civil & Environmental Engineering, Advanced Infrastructure Systems",1900,1900
70,The University of Texas at Arlington,"Bachelor of Science, Information Systems",2001,2001
70,Texas McCombs School of Business,Master of Business Administration - MBA,2008,2008
71,University of Chicago,"Master’s Degree, Analytics",1900,1900
71,Galgotia's College of Engineering and Technology,"Bachelor's Degree, Electronics and Communication Engineering",1900,1900
72,New York University - Leonard N. Stern School of Business,"MBA, Strategy, Finance, Marketing",1900,1900
72,Rutgers University,"BA, Economics, Information Technology & Informatics",1900,1900
73,Harvard Business School,MBA,2002,2004
73,Boğaziçi University,"MSc., Mechanical Engineering",1990,1994
74,Cornell Johnson Graduate School of Management,Master of Business Administration (M.B.A.),2015,2017
74,Delhi College of Engineering,"Bachelor’s Degree, Electronics and communication",2006,2010
75,"Indian Institute of Technology, Madras","BTech, Electronics and Communication",1994,1998
75,"Indian Institute of Management, Calcutta","MBA, Finance, IT, Strategy",1998,2000
76,Maharaja Sayajirao University,"BE, Electronics and Communications",1993,1997
76,University of Illinois Chicago,"Master of Science - MS, Computer Science",1998,2000
76,Stanford University,"Graduate certificate, Data Mining and Applications, Management Science and Engineering",2012,2013
77,Northwestern University,"Bachelor of Arts - BA, Economics, Political Science",1900,1900
77,The Wharton School,"MBA, Marketing, Finance",1900,1900
77,Yale University,"Bachelor of Arts - BA, Economics, Political Science, Ethics",1900,1900
78,Cornell University,"BS, Chemical Engineering",1997,1997
78,William Penn Charter School,,1900,1900
78,Cornell University,"M.Eng, Operations Research and Industrial Engineering",1999,1999
79,The Wharton School,"Master of Business Administration (MBA), Strategy and Marketing",1997,1999
79,Cornell University,"Bachelor of Science (BS), Economics and Marketing",1990,1994
80,Massachusetts Institute of Technology,"Postdoctoral Research Fellow, Organic Chemistry",1999,2000
80,RWTH Aachen University,"PhD, Chemistry",1997,1999
80,University of Cologne,"Diploma, Chemistry",1991,1996
81,"Indian Institute of Technology, Bombay","B. Tech, M. Tech, Mechanical Engineering",1900,1900
82,The Wharton School,Master of Business Administration (MBA),2005,2007
82,"Indian Institute of Technology, Kharagpur",B.Tech,1995,1999
82,The Wharton School,MBA,2005,2007
83,University of Rochester - Simon Business School,"MBA, Competitive and Organizational Strategy, Finance, Pricing",2011,2013
83,United States Military Academy at West Point,"BSc. w/ Honors, Economics",2004,2008
85,University at Buffalo,"Master of Science, Mechanical Engineering",2007,2008
85,Northwestern University,"PhD, Materials Science and Engineering",2009,2014
85,University at Buffalo,"Bachelor of Science, Mechanical Engineering, Physics",2003,2007
86,"University of California, Los Angeles","Master of Business Administration (MBA), Entrepreneurship/Entrepreneurial Studies",2014,2017
86,"University of California, Irvine - The Paul Merage School of Business","Certification in Management for Technical Professionals, Business Administration and Management, General",2012,2012
86,"University of California, Riverside","M.S, Electrical Engineering",2006,2008
87,University of Cambridge,"Bachelors & Masters degrees, Manufacturing Engineering",1994,1998
87,Stanford University Graduate School of Business,MBA,2001,2003
88,Universitat Politècnica de Catalunya,"Master of Science (M.Sc.), Telecommunications Engineering",2009,2012
88,Politecnico di Torino,"Master of Science (M.Sc.), Telecommunications Engineering",2009,2012
88,University of Southern California,"Master’s Degree, Computer Engineering",2011,2012
90,St. Xavier's College,"Bachelor of Arts (B.A.), Economics",1984,1989
90,Indian Institute of Management Ahmedabad,"Master of Business Administration (MBA), Finance, General",1989,1991
91,INSEAD,Master of Business Administration (MBA),2016,2017
91,Birla Vidya Niketan,,2007,2007
91,Delhi College of Engineering,"B.E, Electronics and Communication",2007,2011
92,"Indian Institute of Technology, Bombay","Bachelor of Technology (B.Tech), Mechanical Engineering",2005,2009
92,University of Virginia Darden School of Business,Master of Business Administration (MBA),2013,2015
93,Indian Institute of Management Ahmedabad,"Post Graduate Program in Management, Business Administration and Management, General",2010,2012
93,"Indian Institute of Technology, Delhi","Bachelor of Technology (B.Tech.), Civil Engineering",2006,2010
93,Schulich School of Business - York University,"Master of Business Administration (M.B.A.), Business Administration and Management, General",2011,2011
94,"Indian Institute of Technology, Madras","B. Tech., M. Tech., Mechanical Engineering, Energy Technology",2000,2005
94,Stanford University,"M.S., Decision and Risk Analysis",2005,2007
95,Columbia Business School,Master of Business Administration (MBA),2018,2018
95,Columbia Law School,Doctor of Law (JD),2018,2018
95,Georgetown University,"Bachelor's degree, Government and History",2009,2009
96,Northern Illinois University,"BA, Economics",1900,1900
97,Harvard Business School,"MBA, Business Administration and Management, General",2006,2008
98,"Government Law College, Mumbai","BLS LL.B., Law",2008,2013
98,Central European University,Exchange Programme - CEU Business School,2016,2016
98,Indian Institute of Management Ahmedabad,Post Graduate Programme in Management,2015,2017
99,University of Virginia,"BS, Systems Engineering with High Distinction",1900,1900
99,Northwestern University - McCormick School of Engineering,"Master of Engineering Management (MEM), Design and Operations",1900,1900
99,Northwestern University - Kellogg School of Management,"Master of Business Administration (MBA), Finance, Management & Organizations",1900,1900
100,Panjab University,"Engineer's Degree, Chemical Engineering",2009,2013
100,Duke University - The Fuqua School of Business,"Master of Business Administration (M.B.A.), Concentrations in Strategy",2016,2018
101,University of Virginia,"BA, Economics, Biology",2004,2008
102,The Fletcher School at Tufts University,"MA, International Relations",1900,1900
102,University of Virginia,"BA, Anthropology / Archaeology",1900,1900
104,"Indian Institute of Technology, Kanpur","B.Tech, Biological Sciences and Bioengineering",2006,2010
104,Northwestern University - Kellogg School of Management,"Master of Business Administration (MBA), Marketing",2015,2017
105,Indian Institute of Management Ahmedabad,MBA,1992,1994
105,"Indian Institute of Technology, Madras","B Tech, Computer Science",1988,1992
106,University of Balamand,"Master of Science (MS), Manufacturing Engineering",2009,2011
106,Lebanese University,"Bachelor of Science (BS), Physics",2005,2009
106,Weatherhead School of Management at Case Western Reserve University,Master of Business Administration (M.B.A.),2014,2016
107,CFA Institute,Certified Financial Analyst (CFA),1900,1900
107,University of Brighton,"Bachelor's Degree, European Business with Technology",1900,1900
107,Politecnico di Torino,"First Class degree, Esperto della Produzione Industriale / Production engineering",1900,1900
108,"Indian Institute of Technology, Madras","Engineer’s Degree, Electrical Engineering",2000,2005
108,Indian School of Business,"Post-Graduate Programme in Management, Finance & Strategy",2008,2009
109,Delhi College of Engineering,"Bachelor of Engineering, Electrical Engineering",2007,2011
110,National Aviation University,"MSc, Computer Sciences",2005,2011
110,Northwestern University - Kellogg School of Management,Master of Business Administration - MBA,2016,2018
110,Indian Institute of Management Ahmedabad,"MBA, PGP",2010,2012
110,Netaji Subhas Institute of Technology,"BE, Computers",2005,2009
111,Indian Institute of Management Ahmedabad,Master of Business Administration (M.B.A.),2014,2016
111,HEC Paris,Master of Business Administration (M.B.A.),2015,2015
111,"Indian Institute of Technology, Bombay","Bachelor's Degree, Civil Engineering with Minors in Electrical Engineering",2010,2014
112,University of Connecticut,"Bachelor of Science (B.S.), Computer Science and Engineering",2009,2013
114,National Aviation University,"MSc, Computer Sciences",2005,2011
114,Northwestern University - Kellogg School of Management,Master of Business Administration - MBA,2016,2018
115,Rutgers University,"Mini MBA, Digital Marketing",1900,1900
115,Rutgers University,Masters in Business and Science,1900,1900
115,Punjab Engineering College,Bachelor of Engineering (BE),1900,1900
117,Cornell University,Master of Business Administration - MBA,2014,2016
117,University of St. Thomas,"Bachelor of Arts - BA, Finance",2006,2010
